Title,Link,Organization,Main Research Field,Application Deadline (ISO),Application Deadline (Display)
Master Thesis Projects within AI Planning and Machine Learning,https://exjobb.liu.se/en-US/details/?id=a7221b8c-e884-ef11-a81c-002248a41503,IDA,Datavetenskap,2029-12-30,12/30/2029
Master thesis projects in Sports Analytics (tekfak),https://exjobb.liu.se/en-US/details/?id=8c08ede0-8c81-ef11-a81c-000d3ab2d51f,IDA,Datavetenskap,2028-10-30,10/30/2028
Model-Based Iterative Reconstruction Algorithm for Spectral Computed Tomography,https://exjobb.liu.se/en-US/details/?id=88cb87f2-8390-ef11-a81b-002248a32013,ISY LiU,Elektroteknik,2026-01-30,1/30/2026
Accuracy of Plaque Quantification in Myocardial Computed Tomography,https://exjobb.liu.se/en-US/details/?id=5d179dec-8490-ef11-a81b-002248a32013,ISY LiU,Elektroteknik,2026-01-30,1/30/2026
Accuracy of Plaque Quantification in Myocardial Computed Tomography,https://exjobb.liu.se/en-US/details/?id=89d423d8-8790-ef11-a81b-002248a32013,ISY LiU,Medicinsk teknik,2026-01-30,1/30/2026
Model-Based Iterative Reconstruction Algorithm for Spectral Computed Tomography,https://exjobb.liu.se/en-US/details/?id=3989755f-8990-ef11-a81b-002248a32013,ISY LiU,Medicinsk teknik,2026-01-30,1/30/2026
Optical Methods for Adaptive Photodynamic Therapy,https://exjobb.liu.se/en-US/details/?id=5a90b6ff-1470-ef11-a81c-000d3ad95117,Department of Biomedical Engineering (IMT),Medicinsk teknik,2025-12-31,12/31/2025
Quantification of Biologic Tissue and Media via Trans-illumination SFDI,https://exjobb.liu.se/en-US/details/?id=16926d2c-1570-ef11-a81c-000d3ad95117,Department of Biomedical Engineering (IMT),Medicinsk teknik,2025-12-31,12/31/2025
Multi-depth blood flow imaging and wound assessment in Low Resource Settings,https://exjobb.liu.se/en-US/details/?id=7cdb0f4d-1570-ef11-a81c-000d3ad95117,Department of Biomedical Engineering (IMT),Medicinsk teknik,2025-12-31,12/31/2025
E-paper as a flexible bioelectronic platform,https://exjobb.liu.se/en-US/details/?id=de68c460-8e8b-ef11-a81c-002248a41503,"Department of physics, chemistry and biology (IFM)",Teknisk biologi,2025-12-31,12/31/2025
E-paper as a flexible bioelectronic platform,https://exjobb.liu.se/en-US/details/?id=516035ab-8e8b-ef11-a81c-002248a41503,"Department of physics, chemistry and biology (IFM)",Kemisk biologi,2025-12-31,12/31/2025
E-paper as a flexible bioelectronic platform,https://exjobb.liu.se/en-US/details/?id=aaa8cfdc-8e8b-ef11-a81c-002248a41503,"Department of physics, chemistry and biology (IFM)",Teknisk fysik,2025-12-31,12/31/2025
SkePU backend for CUDA tensor cores,https://exjobb.liu.se/en-US/details/?id=8d826310-8981-ef11-a81c-000d3ab2d51f,IDA,Datavetenskap,2025-12-30,12/30/2025
High-level program optimization in the SkePU precompiler,https://exjobb.liu.se/en-US/details/?id=4f23889c-8981-ef11-a81c-000d3ab2d51f,IDA,Datavetenskap,2025-12-30,12/30/2025
Skeleton computing as a service in the edge-cloud continuum,https://exjobb.liu.se/en-US/details/?id=58299e02-8a81-ef11-a81c-000d3ab2d51f,IDA,Datavetenskap,2025-12-30,12/30/2025
Generalized Stream Processing Specification and Deployment for Heterogeneous Distributed Systems,https://exjobb.liu.se/en-US/details/?id=5cf7436a-8a81-ef11-a81c-000d3ab2d51f,IDA,Datavetenskap,2025-12-30,12/30/2025
Quantifying Adipocyte Density and Fibrosis in Human Liver Using Digital Pathology and MRI,https://exjobb.liu.se/en-US/details/?id=d67ee189-e65d-ee11-a81c-000d3ad77b5b,LiU och Region Östergötland,Medicinsk teknik,2025-12-30,12/30/2025
Quantifying Adipocyte Density and Fibrosis in Human Liver Using Digital Pathology and MRI,https://exjobb.liu.se/en-US/details/?id=8b8b1aa2-f45d-ee11-a81c-000d3ad77b5b,LiU och Region Östergötland,Medicinsk fysik,2025-12-30,12/30/2025
Finding and Understanding Quantum Defects,https://exjobb.liu.se/en-US/details/?id=5ad90fa2-9363-ef11-a81c-000d3ad95117,IFM,Teknisk fysik,2025-12-30,12/30/2025
Machine Learning for Materials Design,https://exjobb.liu.se/en-US/details/?id=6a7b7e1f-9463-ef11-a81c-000d3ad95117,IFM,Teknisk fysik,2025-12-30,12/30/2025
Federated harmonization of MRI volumes,https://exjobb.liu.se/en-US/details/?id=945f2914-5a76-ef11-a81c-000d3ad95117,Department of Biomedical Engineering (IMT),Elektroteknik,2025-12-30,12/30/2025
Federated harmonizaton of x-ray images of femur fractures,https://exjobb.liu.se/en-US/details/?id=a95985cf-5c76-ef11-a81c-000d3ad95117,Department of Biomedical Engineering (IMT),Elektroteknik,2025-12-30,12/30/2025
Synthetic x-ray images of femur fractures,https://exjobb.liu.se/en-US/details/?id=5d63b1d4-6076-ef11-a81c-000d3ad95117,Department of Biomedical Engineering (IMT),Elektroteknik,2025-12-30,12/30/2025
Synthetic x-ray images of femur fractures,https://exjobb.liu.se/en-US/details/?id=d284a6f3-6076-ef11-a81c-000d3ad95117,Department of Biomedical Engineering (IMT),Elektroteknik,2025-12-30,12/30/2025
Machine learning interatomic potentials for energy related materials,https://exjobb.liu.se/en-US/details/?id=6d40dce8-fa86-ef11-a81c-002248a41503,"Department of physics, chemistry and biology, IFM",Teknisk fysik,2025-12-30,12/30/2025
Computer Vision,https://exjobb.liu.se/en-US/details/?id=f8204221-2959-ee11-a81c-000d3ad77b5b,Linköping University,Elektroteknik,2025-11-17,11/17/2025
Optimal uppsampling och mixning för QAM-modulatorer,https://exjobb.liu.se/en-US/details/?id=a6242a9e-8e80-ef11-a81c-000d3a690ba3,Truestream AB,Elektroteknik,2025-06-29,6/29/2025
Non-Obtrusive Detection of Alcohol and Drowsiness Impairments in Drivers Using Camera-Based Monitori,https://exjobb.liu.se/en-US/details/?id=5ed9bd2f-d986-ef11-a81c-002248a41503,VTI and LiU,Medicinsk teknik,2025-06-29,6/29/2025
Mechanical Regulation of Extracellular Vesicle Release and Function in Osteosarcoma,https://exjobb.liu.se/en-US/details/?id=159ae95b-1b86-ef11-a81c-002248a41503,Department of Biomedical Engineering (IMT) and Department of Biomedical and Clinical Sciences (BKV),Medicinsk teknik,2025-05-31,5/31/2025
Mechanical Regulation of Extracellular Vesicle Release and Function in Osteosarcoma,https://exjobb.liu.se/en-US/details/?id=5467126f-3486-ef11-a81c-002248a41503,Department of Biomedical Engineering (IMT) and Department of Biomedical and Clinical Sciences (BKV),Teknisk biologi,2025-05-31,5/31/2025
Mechanical Regulation of Extracellular Vesicle Release and Function in Osteosarcoma,https://exjobb.liu.se/en-US/details/?id=b9238f91-3486-ef11-a81c-002248a41503,Department of Biomedical Engineering (IMT) and Department of Biomedical and Clinical Sciences (BKV),Kemisk biologi,2025-05-31,5/31/2025
Rapid pre-concentration and optical detection of ultralow bacteria concentrations in drinking water,https://exjobb.liu.se/en-US/details/?id=92a94524-8f8b-ef11-a81c-002248a41503,"Department of physics, chemistry and biology (IFM)",Teknisk biologi,2025-05-31,5/31/2025
Rapid pre-concentration and optical detection of ultralow bacteria concentrations in drinking water,https://exjobb.liu.se/en-US/details/?id=0580203b-8f8b-ef11-a81c-002248a41503,"Department of physics, chemistry and biology (IFM)",Kemisk biologi,2025-05-31,5/31/2025
Electroactive polymers for wearable theranostics,https://exjobb.liu.se/en-US/details/?id=ea0e3a7d-8f8b-ef11-a81c-002248a41503,"Department of physics, chemistry and biology (IFM)",Teknisk biologi,2025-05-31,5/31/2025
Electroactive polymers for wearable theranostics,https://exjobb.liu.se/en-US/details/?id=b6d45492-8f8b-ef11-a81c-002248a41503,"Department of physics, chemistry and biology (IFM)",Kemisk biologi,2025-05-31,5/31/2025
Hyperspectral imaging of the skin microvascular blood oxygen saturation and blood amount,https://exjobb.liu.se/en-US/details/?id=6f74fb44-a480-ef11-a81c-000d3a690ba3,Department of Biomedical Engineering (IMT),Medicinsk teknik,2025-05-30,5/30/2025
Toxin and Pesticide Free Weed Control using Drones,https://exjobb.liu.se/en-US/details/?id=e9f045bc-1587-ef11-a81c-002248a41503,Flexiflow,Elektroteknik,2025-05-30,5/30/2025
Applying Machine Learning to Quantum Defects,https://exjobb.liu.se/en-US/details/?id=c90b6163-9d71-ef11-a81c-000d3ad95117,IFM,Teknisk fysik,2025-03-30,3/30/2025
Algoritmer för dricksvattenkvalitet,https://exjobb.liu.se/en-US/details/?id=32adb843-998b-ef11-a81c-002248a41503,"Department of physics, chemistry and biology, IFM",Teknisk fysik,2025-02-28,2/28/2025
Flödescytometri för dricksvattenkvalitet,https://exjobb.liu.se/en-US/details/?id=de5b113c-9a8b-ef11-a81c-002248a41503,"Department of physics, chemistry and biology, IFM",Teknisk biologi,2025-02-28,2/28/2025
Algoritmer för dricksvattenkvalitet,https://exjobb.liu.se/en-US/details/?id=bed9f5ec-9c8b-ef11-a81c-002248a41503,"Department of physics, chemistry and biology, IFM",Teknisk biologi,2025-02-28,2/28/2025
Algoritmer för dricksvattenkvalitet,https://exjobb.liu.se/en-US/details/?id=03b68b7e-9d8b-ef11-a81c-002248a41503,"Department of physics, chemistry and biology, IFM",Programmering,2025-02-28,2/28/2025
Algoritmer för dricksvattenkvalitet,https://exjobb.liu.se/en-US/details/?id=cc53d0a8-9d8b-ef11-a81c-002248a41503,"Department of physics, chemistry and biology, IFM",Datateknik,2025-02-28,2/28/2025
Master Thesis Projects in the Areas of Image and Video Analysis,https://exjobb.liu.se/en-US/details/?id=000ff734-8c80-ef11-a81c-000d3a690ba3,IDA,Datavetenskap,2025-02-15,2/15/2025
Master Thesis Projects in the Areas of Social Media Dynamics and Fake News,https://exjobb.liu.se/en-US/details/?id=df43dcc8-8c80-ef11-a81c-000d3a690ba3,IDA,Datavetenskap,2025-02-15,2/15/2025
Master Thesis Projects in the Areas of Security and Privacy,https://exjobb.liu.se/en-US/details/?id=e4f19362-8e80-ef11-a81c-000d3a690ba3,IDA,Datavetenskap,2025-02-15,2/15/2025
Master Thesis Projects in the Areas of Security and Privacy,https://exjobb.liu.se/en-US/details/?id=ddbf4a8e-0080-ef11-a81c-000d3ad95117,ADIT @ IDA @ LiU,,2025-02-15,2/15/2025
Master Thesis Projects in the Areas of Social Media Dynamics and Fake News,https://exjobb.liu.se/en-US/details/?id=221ef5da-0080-ef11-a81c-000d3ad95117,ADIT @ IDA @ LiU,,2025-02-15,2/15/2025
Master Thesis Projects in the Areas of Image and Video Analysis,https://exjobb.liu.se/en-US/details/?id=dd857b15-0180-ef11-a81c-000d3ad95117,ADIT @ IDA @ LiU,,2025-02-15,2/15/2025
Master Thesis Projects in the Areas of Semantics of Information and Goal-oriented Communications,https://exjobb.liu.se/en-US/details/?id=40db041e-818f-ef11-a81c-002248a41503,IDA,Datavetenskap,2025-02-15,2/15/2025
Hållbar stadsutveckling – Om att anta innovativ infrastruktur i stadsförnyelse,https://exjobb.liu.se/en-US/details/?id=5fe7ad6b-4a82-ef11-a81c-000d3ab2d51f,Industriell miljöteknik/IEI,Energi- och miljöteknik,2025-02-01,2/1/2025
Lokalt anpassat beslutstöd för återvinning av slaggrus i vägkonstruktioner,https://exjobb.liu.se/en-US/details/?id=4b8152b6-4b82-ef11-a81c-000d3ab2d51f,Industriell miljöteknik/IEI,,2025-02-01,2/1/2025
Vad kostar egentligen ett hål i gatan?,https://exjobb.liu.se/en-US/details/?id=17e442df-7984-ef11-a81c-002248a41503,Industriell miljöteknik/IEI,Energi- och miljöteknik,2025-02-01,2/1/2025
Eye tracking för XR-headset,https://exjobb.liu.se/en-US/details/?id=2f4e6d05-4d70-ef11-a81c-000d3ad95117,"FOI, Totalförsvarets forskningsinstitut",Datateknik,2025-01-31,1/31/2025
Taktisk display i XR-miljö,https://exjobb.liu.se/en-US/details/?id=44c0b2e0-4d70-ef11-a81c-000d3ad95117,"FOI, Totalförsvarets forskningsinstitut",Datateknik,2025-01-31,1/31/2025
Utveckling av simulatorlösning i XR-miljö,https://exjobb.liu.se/en-US/details/?id=6598ff77-4e70-ef11-a81c-000d3ad95117,"FOI, Totalförsvarets forskningsinstitut",Datateknik,2025-01-31,1/31/2025
Ergonomianpassning för XR-simulator,https://exjobb.liu.se/en-US/details/?id=dfe6f126-4f70-ef11-a81c-000d3ad95117,"FOI, Totalförsvarets forskningsinstitut",Datateknik,2025-01-31,1/31/2025
Enhancing Drowsiness Monitoring Systems: The Role of KSS in Accurate Fatigue Detection,https://exjobb.liu.se/en-US/details/?id=12b89d6c-d986-ef11-a81c-002248a41503,VTI and LiU,Medicinsk teknik,2025-01-31,1/31/2025
Återvinningsbolagens roll i att öka cirkulationen av uttjänta material,https://exjobb.liu.se/en-US/details/?id=736c3854-4482-ef11-a81c-000d3ab2d51f,Industriell miljöteknik/IEI,Energi- och miljöteknik,2025-01-30,1/30/2025
Biogas i ett mer elektrifierat och vätgasbaserat samhälle,https://exjobb.liu.se/en-US/details/?id=108b68b8-4882-ef11-a81c-000d3ab2d51f,Industriell miljöteknik/IEI,Energi- och miljöteknik,2025-01-30,1/30/2025
Innovation Management of Sustainable Development,https://exjobb.liu.se/en-US/details/?id=fb5d174b-6e6f-ef11-a81c-000d3ad95117,Environmental Technology and Management,Energi- och miljöteknik,2025-01-30,1/30/2025
Exploring Swedish Actors’ Roles in Global Dissemination of Biogas Systems,https://exjobb.liu.se/en-US/details/?id=4f660e14-f47b-ef11-a81c-000d3ad95117,IEI - Linköping University,Energi- och miljöteknik,2025-01-30,1/30/2025
Hur kan kommunala bolag bidra i kommuners strategiska hållbarhetsarbete,https://exjobb.liu.se/en-US/details/?id=04d87af7-f47b-ef11-a81c-000d3ad95117,IEI - Linköpings universitet,Energi- och miljöteknik,2025-01-30,1/30/2025
Automated Analysis of Student Discourse for Improved Teaching Feedback,https://exjobb.liu.se/en-US/details/?id=d3701007-f689-ef11-a81c-002248a41503,IDA,Datavetenskap,2025-01-30,1/30/2025
Studying water exchange in microenvironments with diffusion MRI,https://exjobb.liu.se/en-US/details/?id=05cd54a8-1a8a-ef11-a81c-002248a41503,Department of Biomedical Engineering (IMT),Medicinsk teknik,2025-01-30,1/30/2025
Computer Vision / Datorseende,https://exjobb.liu.se/en-US/details/?id=ac0d351c-778f-ef11-a81c-002248a41503,Linköping University,Datateknik,2025-01-15,1/15/2025
Hur kan nya företagsetableringar bidra till ökad resurseffektivitet?,https://exjobb.liu.se/en-US/details/?id=4f0efae3-4982-ef11-a81c-000d3ab2d51f,Industriell miljöteknik/IEI,Energi- och miljöteknik,2025-01-14,1/14/2025
Vad händer i världens mest resurseffektiva region?,https://exjobb.liu.se/en-US/details/?id=4c34762d-4c82-ef11-a81c-000d3ab2d51f,Industriell miljöteknik/IEI,Energi- och miljöteknik,2025-01-14,1/14/2025
Öppnas möjligheter för industriell symbios av bygget av Ostlänken?,https://exjobb.liu.se/en-US/details/?id=b0a3ef71-7a84-ef11-a81c-002248a41503,Industriell miljöteknik/IEI,Energi- och miljöteknik,2025-01-14,1/14/2025
Cyberhot i en cirkulär ekonomi,https://exjobb.liu.se/en-US/details/?id=88155aef-7e8f-ef11-a81c-002248a41503,IDA,Datavetenskap,2025-01-07,1/7/2025
Analys av desinformation för utvärdering av vaccinationsprogram,https://exjobb.liu.se/en-US/details/?id=51486c66-7f8f-ef11-a81c-002248a41503,IDA,Datavetenskap,2025-01-07,1/7/2025
Selecting and Filling SPARQL Templates from Natural Language Statements,https://exjobb.liu.se/en-US/details/?id=9f4d38c7-7f8f-ef11-a81c-002248a41503,IDA,Datavetenskap,2025-01-07,1/7/2025
Modelling access control for the circular economy,https://exjobb.liu.se/en-US/details/?id=d4294d20-808f-ef11-a81c-002248a41503,IDA,Datavetenskap,2025-01-07,1/7/2025
Visualisering av vaccindata,https://exjobb.liu.se/en-US/details/?id=c77bd07b-808f-ef11-a81c-002248a41503,IDA,Datavetenskap,2025-01-07,1/7/2025
Cross-Border Competitiveness in the EU ETS 2: A Case Study of the Transport Sector in Border Regions,https://exjobb.liu.se/en-US/details/?id=b6199359-f67b-ef11-a81c-000d3ad95117,IEI - Linköping University,Energi- och miljöteknik,2025-01-04,1/4/2025
Multi-Modal Learning for Detecting Cargo Loading and Unloading Events,https://exjobb.liu.se/en-US/details/?id=59f0c13e-6182-ef11-a81c-000d3ab2d51f,Volvo Group Trucks Technology,Elektroteknik,2024-12-31,12/31/2024
Multi-Vehicle Detection and Tracking Using Sound Modality,https://exjobb.liu.se/en-US/details/?id=eca21699-6182-ef11-a81c-000d3ab2d51f,Volvo Group Trucks Technology,Elektroteknik,2024-12-31,12/31/2024
Using Generative AI to visualize states in AI Planning,https://exjobb.liu.se/en-US/details/?id=0d61dca9-accc-ee11-a81c-000d3ab758d4,IDA - Artificial Intelligence & Integrated Computer Systems,Datavetenskap,2024-12-31,12/31/2024
Master Thesis - Information Theoretic Security Proofs and Methods,https://exjobb.liu.se/en-US/details/?id=bbc9cfbb-d05a-ee11-a81c-000d3ad77b5b,LiU ISY ICG,Tillämpad matematik,2024-12-31,12/31/2024
Master Thesis - Analysis of Physical Unclonable Functions,https://exjobb.liu.se/en-US/details/?id=d4cf92cd-d15a-ee11-a81c-000d3ad77b5b,LiU ISY ICG,Elektroteknik,2024-12-31,12/31/2024
Master Thesis on Privacy for Federated Learning,https://exjobb.liu.se/en-US/details/?id=8d8dd603-ba5e-ee11-a81c-000d3ad77b5b,ISY ICG,Datavetenskap,2024-12-31,12/31/2024
Estimation of Electricity Spot Prices in the Swedish Power Market,https://exjobb.liu.se/en-US/details/?id=cef62e48-f15e-ef11-a81c-000d3ad95117,Bitvis,Elektroteknik,2024-12-31,12/31/2024
Evaluation Methodology for SpotPrice Predictors with Respect to EVCharging,https://exjobb.liu.se/en-US/details/?id=5c90dfd6-f15e-ef11-a81c-000d3ad95117,Bitvis,Elektroteknik,2024-12-31,12/31/2024
Optimization and planning of charging infrastructure for electrified forest transportation,https://exjobb.liu.se/en-US/details/?id=bbe5d752-f25e-ef11-a81c-000d3ad95117,Linköping University,Elektroteknik,2024-12-31,12/31/2024
Control of low-voltage grid stability utilizing V2G and smart charging,https://exjobb.liu.se/en-US/details/?id=89697b66-b95f-ef11-a81c-000d3ad95117,Linköping University,Elektroteknik,2024-12-31,12/31/2024
Modeling of House Hould Power Consumption for V2H Analysis,https://exjobb.liu.se/en-US/details/?id=a625f1ef-3674-ef11-a81c-000d3ad95117,Linköping University,Elektroteknik,2024-12-31,12/31/2024
Cardiovascular digital twins from 4D CT data,https://exjobb.liu.se/en-US/details/?id=6a9979bb-1f7b-ef11-a81c-000d3ad95117,Department of Biomedical Engineering (IMT),Medicinsk teknik,2024-12-31,12/31/2024
Creation of an AR Simulation for Human-Robot Interaction Research,https://exjobb.liu.se/en-US/details/?id=0782d735-d77c-ef11-a81c-000d3ad95117,IDA,Datavetenskap,2024-12-31,12/31/2024
Master Thesis at Ericsson Site Linköping,https://exjobb.liu.se/en-US/details/?id=6bdae827-5d85-ee11-a81c-002248a196bc,Ericsson,,2024-12-31,12/31/2024
Reducing Carbon Emissions in Machine Learning with Representative Subsets,https://exjobb.liu.se/en-US/details/?id=7537d570-c583-ef11-a81c-002248a41503,IDA,Datavetenskap,2024-12-31,12/31/2024
Learned Aggregations Functions for Graph Neural Networks,https://exjobb.liu.se/en-US/details/?id=2b7df506-c683-ef11-a81c-002248a41503,IDA,Datavetenskap,2024-12-31,12/31/2024
Invertible Neural Networks for Knowledge Graph Embeddings,https://exjobb.liu.se/en-US/details/?id=e9311aa4-c683-ef11-a81c-002248a41503,IDA,Datavetenskap,2024-12-31,12/31/2024
Poor man’s version of ChatGPT,https://exjobb.liu.se/en-US/details/?id=a5c8cc63-98fc-ee11-a81c-000d3a64a754,Linköpings universitet Informationskodning,Datavetenskap,2024-12-30,12/30/2024
Poor man’s version of ChatGPT,https://exjobb.liu.se/en-US/details/?id=ca65f3d6-98fc-ee11-a81c-000d3a64a754,Linköpings universitet Informationskodning,Matematik,2024-12-30,12/30/2024
ML with human-centric synthetic training data,https://exjobb.liu.se/en-US/details/?id=39d9f1bb-537d-ee11-a81c-000d3a65df9c,Linköping University,Medieteknik,2024-12-30,12/30/2024
Data augmentation via synthetic image generation,https://exjobb.liu.se/en-US/details/?id=1a17b920-547d-ee11-a81c-000d3a65df9c,Linköping University,Medieteknik,2024-12-30,12/30/2024
Visualization and importance sampling in deep learning,https://exjobb.liu.se/en-US/details/?id=54800c6d-547d-ee11-a81c-000d3a65df9c,Linköping University,Medieteknik,2024-12-30,12/30/2024
Rendering with non-parametric data-driven BRDF model,https://exjobb.liu.se/en-US/details/?id=b748c59d-547d-ee11-a81c-000d3a65df9c,Linköping University,Medieteknik,2024-12-30,12/30/2024
Large-scale image exploration for data-centered machine learning,https://exjobb.liu.se/en-US/details/?id=51daf4e8-547d-ee11-a81c-000d3a65df9c,Linköping University,Medieteknik,2024-12-30,12/30/2024
A learning-based video compression with sparse representation and entropy coding,https://exjobb.liu.se/en-US/details/?id=c104371d-557d-ee11-a81c-000d3a65df9c,Linköping University,Medieteknik,2024-12-30,12/30/2024
Fair Feature Extraction for Generative Models,https://exjobb.liu.se/en-US/details/?id=67a9cb48-557d-ee11-a81c-000d3a65df9c,Linköping University,Medieteknik,2024-12-30,12/30/2024
Additive manufacturing anomaly detection - Industry collaboration with Interspectral,https://exjobb.liu.se/en-US/details/?id=9e313f43-5b7d-ee11-a81c-000d3a65df9c,Linköping University,Medieteknik,2024-12-30,12/30/2024
Visualizing action plans with generative machine learning models,https://exjobb.liu.se/en-US/details/?id=61a6e748-dd4c-ee11-a81c-000d3ab30f00,IDA @ LiU,Datavetenskap,2024-12-30,12/30/2024
Parallel I/O for skeleton programs in SkePU,https://exjobb.liu.se/en-US/details/?id=3201392b-904d-ee11-a81c-000d3ab30f00,IDA @ LiU,Datavetenskap,2024-12-30,12/30/2024
Learning-based Motion Planner,https://exjobb.liu.se/en-US/details/?id=b0128458-b583-ee11-a81c-002248a196bc,Linköpings universitet Reglerteknik,Elektroteknik,2024-12-30,12/30/2024
Characterizing deadlocks in message passing applications,https://exjobb.liu.se/en-US/details/?id=d81a97ed-3c88-ee11-a81c-002248a196bc,IDA,Datavetenskap,2024-12-30,12/30/2024
Extending applicability of symbolic execution based uncovering of shared memory barriers in GPU prog,https://exjobb.liu.se/en-US/details/?id=24157b1b-4388-ee11-a81c-002248a196bc,IDA,Datavetenskap,2024-12-30,12/30/2024
Evaluation of Federated Learning Algorithms for the task of Intrusion Detection,https://exjobb.liu.se/en-US/details/?id=7bc52631-0b91-ef11-a81b-002248a32013,IDA,Datavetenskap,2024-12-30,12/30/2024
Energy Transition Investment in Transport Sector – Scope 4,https://exjobb.liu.se/en-US/details/?id=1c9d4f7d-3686-ef11-a81c-002248a41503,Environmental Technology and Management/IEI,Energi- och miljöteknik,2024-12-30,12/30/2024
Sustainable Finance – Rating the Raters,https://exjobb.liu.se/en-US/details/?id=216be2c5-3886-ef11-a81c-002248a41503,Environmental Technology and Management/IEI,Energi- och miljöteknik,2024-12-30,12/30/2024
SAAB New Sustainable Logistics Center,https://exjobb.liu.se/en-US/details/?id=23067b60-3986-ef11-a81c-002248a41503,Environmental Technology and Management/IEI,Energi- och miljöteknik,2024-12-30,12/30/2024
Sustainable Finance and Industry Transition,https://exjobb.liu.se/en-US/details/?id=610a554d-3a86-ef11-a81c-002248a41503,Environmental Technology and Management/IEI,Energi- och miljöteknik,2024-12-30,12/30/2024
Besättningsplanering hos BRA,https://exjobb.liu.se/en-US/details/?id=5a79fd0b-9bc1-ee11-a81c-000d3ab6ca01,Linköpings Universitet,Logistik,2024-12-29,12/29/2024
Software-Defined Architecture for Virtual Private LAN Service,https://exjobb.liu.se/en-US/details/?id=72ff6631-0c91-ef11-a81b-002248a32013,IDA,Datavetenskap,2024-12-19,12/19/2024
Collection and Analysis of Aircraft Data Communication,https://exjobb.liu.se/en-US/details/?id=ca0d71c1-0c91-ef11-a81b-002248a32013,IDA,Datavetenskap,2024-12-19,12/19/2024
Cybersecurity in Digital Twin Applications: Ensuring Authenticity and Confidentiality,https://exjobb.liu.se/en-US/details/?id=625e966a-0d91-ef11-a81b-002248a32013,IDA,Datavetenskap,2024-12-19,12/19/2024
A security analysis of ADS-L and the potential application with drone ID,https://exjobb.liu.se/en-US/details/?id=a36bc8da-0d91-ef11-a81b-002248a32013,IDA,Datavetenskap,2024-12-19,12/19/2024
Performance Evaluation of HIP in Future Communication Infrastructure,https://exjobb.liu.se/en-US/details/?id=79f35047-0e91-ef11-a81b-002248a32013,IDA,Datavetenskap,2024-12-19,12/19/2024
Real-Time Anomaly Detection in ADS-B Systems Using AI,https://exjobb.liu.se/en-US/details/?id=0fcead9d-0e91-ef11-a81b-002248a32013,IDA,Datavetenskap,2024-12-19,12/19/2024
Challenges and safety aspects in Remote train driving 2,https://exjobb.liu.se/en-US/details/?id=fe3a7862-8980-ef11-a81c-000d3a690ba3,IDA,Datavetenskap,2024-12-14,12/14/2024
Challenges and safety aspects in Remote train driving 1,https://exjobb.liu.se/en-US/details/?id=b3457e24-8a80-ef11-a81c-000d3a690ba3,IDA,Datavetenskap,2024-12-14,12/14/2024
Identifying Photon/Qubit Interfaces for Future Quantum Information Technologies,https://exjobb.liu.se/en-US/details/?id=8a59a096-3c1f-ef11-a81c-0022489d2cd6,"Department of physics, chemistry and biology, IFM",Fysik,2024-12-14,12/14/2024
Designing Nanometer Sized Light Sources for Next-Generation Near-Infrared Optoelectronics,https://exjobb.liu.se/en-US/details/?id=305d750a-3d1f-ef11-a81c-0022489d2cd6,"Department of physics, chemistry and biology, IFM",Fysik,2024-12-14,12/14/2024
Studies of symmetries in Geometry,https://exjobb.liu.se/en-US/details/?id=13a4e74b-3c73-ee11-a81c-000d3a65df9c,Matematiska institutionen,Matematik,2024-12-12,12/12/2024
Studies of symmetries in Geometry,https://exjobb.liu.se/en-US/details/?id=661418fe-3c73-ee11-a81c-000d3a65df9c,Matematiska institutionen,Matematik,2024-12-12,12/12/2024
Olika problem inom graffärgningsteori,https://exjobb.liu.se/en-US/details/?id=ec86a7e9-d077-ee11-a81c-000d3a65df9c,Matematiska institutionen,Matematik,2024-12-12,12/12/2024
Olika problem inom graffärgningsteori,https://exjobb.liu.se/en-US/details/?id=87051166-d177-ee11-a81c-000d3a65df9c,Matematiska institutionen,Matematik,2024-12-12,12/12/2024
Statistisk modellering av personskador i samband med viltolyckor på det svenska vägnätet,https://exjobb.liu.se/en-US/details/?id=68ac9a33-5f5c-ee11-a81c-000d3ad77b5b,Matematiska institutionen,Tillämpad matematik,2024-12-12,12/12/2024
Student Set Generation - Conflict handling for University Course Timetabling,https://exjobb.liu.se/en-US/details/?id=f870c9b2-1b61-ee11-a81c-000d3ad77b5b,Matematiska institutionen,Tillämpad matematik,2024-12-12,12/12/2024
